{
  "contract_version": "0.2.0",
  "event_id": "00000001-1111-4111-8111-000000000001",
  "source_system": "precisionfarm",
  "shared_producer_id": "00000002-1111-4111-8111-000000000002",
  "shared_farm_id": "00000003-1111-4111-8111-000000000003",
  "shared_field_id": "00000004-1111-4111-8111-000000000004",
  "resource_id": "00000005-1111-4111-8111-000000000005",
  "resource_type": "guidance",
  "resource_revision": 1,
  "base_revision": 0,
  "boundary_revision": 1,
  "occurred_at": "2026-10-22T15:00:00Z",
  "operation": "upsert",
  "payload": {
    "name": "linhas_verao",
    "integration_name": "linhas_verao",
    "status": "published",
    "season": null,
    "cropping_cycle": "summer",
    "operation_category": "planting",
    "spacing_m": 7.8,
    "purpose": "visualization",
    "geometry": {
      "type": "FeatureCollection",
      "features": [
        {
          "type": "Feature",
          "id": "1",
          "properties": {
            "kind": "guidance",
            "sequence": 1
          },
          "geometry": {
            "type": "LineString",
            "coordinates": [
              [
                -50,
                -24
              ],
              [
                -49.999,
                -23.999
              ]
            ]
          }
        }
      ]
    }
  }
}